No.,Manufacturer,Product Name,Source(Link),Category,Type
607,Swann,"Swann Home DVR Security Camera System with 1TB HDD, 8 Channel 4 Camera, 1080p Full HD Video, Indoor or Outdoor Wired Surveillance CCTV, Color Night Vision, Heat Motion Detection, LED Lights, 845804",https://a.co/d/3wSSavW,"Security, Safety& Entry Management",Comprehensive Security Systems/ Smart Camera
608,Swann,"Swann 4K Master Security Camera System, 8 Bullet 8 Dome IP Cameras, 16-Ch NVR with 2TB HDD, Indoor/Outdoor PoE Wired, 24/7 Home Surveillance, Color Night Vision, True Detect, Spotlights, 1676808B8D",https://a.co/d/io080ZG,"Security, Safety& Entry Management",Comprehensive Security Systems/ Smart Camera
609,Kasa Smart,"Kasa Smart 2023 New Indoor Pan-Tilt Security Camera, 1080p HD Dog Camera w/Night Vision, Motion Detection for Baby & Pet Monitor, Cloud & SD Card Storage, Works w/Alexa & Google Home, 2.4G WiFi (EC71)",https://a.co/d/a3mYVa7,"Security, Safety& Entry Management",Comprehensive Security Systems/ Smart Camera
610,Kasa Smart,"Kasa Smart Security Camera for Baby monitor, 1080p HD Indoor-Camera for Home Security with Motion Detection, Two-Way Audio, Night Vision, Cloud & SD Card Storage, Works with Alexa & Google Home (EC60)",https://a.co/d/c8iSKsG,"Security, Safety& Entry Management",Comprehensive Security Systems/ Smart Camera
611,Kasa Smart,"Kasa Smart 2K QHD Security Camera Outdoor Wired, IP65, Starlight Sensor & 98Ft Night Vision, Motion/Person Detection, 2 Way Audio w/Siren, Cloud/SD Card Storage, Alexa &Google Home Compatible(KC420WS)",https://a.co/d/gAdqb5r,"Security, Safety& Entry Management",Comprehensive Security Systems/ Smart Camera
612,TP-Link,"TP-Link Tapo 2K QHD Security Camera Outdoor Wired, Starlight Sensor for Color Night Vision, Free AI Detection, Works with Alexa & Google Home, Built-in Siren, Cloud/SD Card Storage (Tapo C320WS)",https://a.co/d/hRzFYK1,"Security, Safety& Entry Management",Comprehensive Security Systems/ Smart Camera
613,TP-Link,"Tapo 1080P Outdoor Wired Pan/Tilt Security Wi-Fi Camera, 360° View, Motion Tracking, Works with Alexa & Google Home, Night Vision, Free AI Detection, Cloud & SD Card Storage(up to 512GB), Tapo C500",https://a.co/d/78x18g7,"Security, Safety& Entry Management",Comprehensive Security Systems/ Smart Camera
614,TP-Link,"TP-Link Tapo Pan/Tilt Security Camera for Baby Monitor, Pet Camera w/ Motion Detection, 1080P, 2-Way Audio, Night Vision, Cloud & SD Card Storage, Works with Alexa & Google Home (Tapo C200)",https://a.co/d/gLVcuOc,"Security, Safety& Entry Management",Comprehensive Security Systems/ Smart Camera
615,Tuyasmart Smart Life,Tuya Camera WIFI IP Wireless Smart Life Compatible Google Home Assistant Alexa 1080P PTZ For House Security Surveillance Indoor,https://www.aliexpress.us/item/3256804220586209.html?src=google&src=google&albch=shopping&acnt=708-803-3821&slnk=&plac=&mtctp=&albbt=Google_7_shopping&albagn=888888&isSmbAutoCall=false&needSmbHouyi=false&albcp=19108228023&albag=&trgt=&crea=en3256804220586209&netw=x&device=c&albpg=&albpd=en3256804220586209&gad_source=1&gclid=CjwKCAjwouexBhAuEiwAtW_ZxyLROqO3lS9YC_bpzPA7vlRLH4O7CZvMWmewfzFqlPTAIxh7T89mKBoCmikQAvD_BwE&gclsrc=aw.ds&aff_fcid=5defaef405bb4150af7a05656be23015-1715108275025-00400-UneMJZVf&aff_fsk=UneMJZVf&aff_platform=aaf&sk=UneMJZVf&aff_trace_key=5defaef405bb4150af7a05656be23015-1715108275025-00400-UneMJZVf&terminal_id=10066eed44444a7c886b74eb4d965d6b&afSmartRedirect=y&gatewayAdapt=glo2usa,"Security, Safety& Entry Management",Comprehensive Security Systems/ Smart Camera
616,Tuyasmart Smart Life,Tuya Smart ONVIF 3MP 2.4G Wireless PTZ Auto Tracking Sound Detection 5MP 5G Dual Band WiFi Alexa Google Surveillance CCTV Camera,https://www.aliexpress.us/item/3256805084604155.html?src=google&src=google&albch=shopping&acnt=708-803-3821&slnk=&plac=&mtctp=&albbt=Google_7_shopping&albagn=888888&isSmbAutoCall=false&needSmbHouyi=false&albcp=19108228023&albag=&trgt=&crea=en3256805084604155&netw=x&device=c&albpg=&albpd=en3256805084604155&gad_source=1&gclid=CjwKCAjwouexBhAuEiwAtW_Zx2ta_O4LC4991XT4UCVNC1Sw7VWu_QL9Oruc3GOhonrtIufBikvPfhoCHMUQAvD_BwE&gclsrc=aw.ds&aff_fcid=abbc89acc54e49eb8c389815ab19c62a-1715108276243-06516-UneMJZVf&aff_fsk=UneMJZVf&aff_platform=aaf&sk=UneMJZVf&aff_trace_key=abbc89acc54e49eb8c389815ab19c62a-1715108276243-06516-UneMJZVf&terminal_id=10066eed44444a7c886b74eb4d965d6b&afSmartRedirect=y&gatewayAdapt=glo2usaa,"Security, Safety& Entry Management",Comprehensive Security Systems/ Smart Camera
617,Tuyasmart Smart Life,Tuya Camera Tuyasmart Smart Life 1080 HD IP Camera Wifi Monitor Intercom Rotation Night Vision Function Android IOS APP,https://www.aliexpress.us/item/2255800139444981.html?src=google&src=google&albch=shopping&acnt=708-803-3821&slnk=&plac=&mtctp=&albbt=Google_7_shopping&albagn=888888&isSmbAutoCall=false&needSmbHouyi=false&albcp=19623912707&albag=&trgt=&crea=en2255800139444981&netw=x&device=c&albpg=&albpd=en2255800139444981&gad_source=1&gclid=CjwKCAjwouexBhAuEiwAtW_Zx3asZYm6GKso6HteKiHsA82vCFlOxuMRZZRNrFlPTe0SWhlrvmiDLBoCwlsQAvD_BwE&gclsrc=aw.ds&aff_fcid=be945a77dac843da9afdc45704f231d9-1715108278046-03119-UneMJZVf&aff_fsk=UneMJZVf&aff_platform=aaf&sk=UneMJZVf&aff_trace_key=be945a77dac843da9afdc45704f231d9-1715108278046-03119-UneMJZVf&terminal_id=10066eed44444a7c886b74eb4d965d6b&afSmartRedirect=y&gatewayAdapt=glo2usa,"Security, Safety& Entry Management",Comprehensive Security Systems/ Smart Camera
618,Wyze Labs,Wyze Cam,https://www.wyze.com/products/wyze-cam,"Security, Safety& Entry Management",Comprehensive Security Systems/ Smart Camera
619,Zmodo,"Zmodo 1080p Outdoor Wireless Camera, 2 Pack Indoor Outdoor WiFi Cameras, IR Night Vision, Motion Detection, Remote View, Easy Setup, White, Plug-In, Compatible with Alexa",https://a.co/d/fQcmLa9,"Security, Safety& Entry Management",Comprehensive Security Systems/ Smart Camera
620,Zmodo,"Zmodo Mini Pro -WiFi Indoor Camera for Home Security, 1080p HD Smart IP Cam with Night Vision, 2-Way Audio, AI-powered Motion Detection, Phone App, Pet Camera- Works with Alexa and Google",https://a.co/d/3ZQrraN,"Security, Safety& Entry Management",Comprehensive Security Systems/ Smart Camera
621,Amazon,Amazon Cloud Cam,https://www.amazon.com/,"Security, Safety& Entry Management",Comprehensive Security Systems/ Smart Camera
622,Ring (Amazon),Ring Stick Up Cam Battery,https://ring.com/products/stick-up-security-camera-battery,"Security, Safety& Entry Management",Comprehensive Security Systems/ Smart Camera
623,Ring (Amazon),Ring Indoor Cam,https://ring.com/,"Security, Safety& Entry Management",Comprehensive Security Systems/ Smart Camera
624,Ring (Amazon),"Ring Spotlight Cam Plus, Battery | Two-Way Talk, Color Night Vision, and Security Siren (2022 release) - White",https://a.co/d/ixrpE60,"Security, Safety& Entry Management",Comprehensive Security Systems/ Smart Camera
625,Ring (Amazon),"Ring Floodlight Cam Wired Pro with Bird’s Eye View and 3D Motion Detection, White",https://a.co/d/1k4bQ48,"Security, Safety& Entry Management",Comprehensive Security Systems/ Smart Camera
626,Ring (Amazon),"Ring Floodlight Cam Wired Plus with motion-activated 1080p HD video, Black (2021 release)",https://a.co/d/3UxDexA,"Security, Safety& Entry Management",Comprehensive Security Systems/ Smart Camera
627,Ring (Amazon),"Ring Spotlight Cam Plus, Plug-in | Two-Way Talk, Color Night Vision, and Security Siren (2022 release) - White",https://a.co/d/alxAZE3,"Security, Safety& Entry Management",Comprehensive Security Systems/ Smart Camera
628,Ring (Amazon),"Ring Indoor Cam (2nd Gen) | latest generation, 2023 release | 1080p HD Video & Color Night Vision, Two-Way Talk, and Manual Audio & Video Privacy Cover | White",https://a.co/d/4iLbDvh,"Security, Safety& Entry Management",Comprehensive Security Systems/ Smart Camera
629,Blink (Amazon),Blink Indoor Camera,https://blinkforhome.com/video-storage,"Security, Safety& Entry Management",Comprehensive Security Systems/ Smart Camera
630,Blink (Amazon),"Blink Mini – Compact indoor plug-in smart security camera, 1080p HD video, night vision, motion detection, two-way audio, easy set up, Works with Alexa – 1 camera (White)",https://a.co/d/71uFume,"Security, Safety& Entry Management",Comprehensive Security Systems/ Smart Camera
631,Blink (Amazon),"Blink Outdoor 4 (4th Gen) — Wire-free smart security camera, two-year battery life, two-way audio, HD live view, enhanced motion detection, Works with Alexa – 1 camera system",https://a.co/d/e0QXEwY,"Security, Safety& Entry Management",Comprehensive Security Systems/ Smart Camera
632,Blink (Amazon),"Blink Outdoor 4 (4th Gen) — Wire-free smart security camera, two-year battery life, two-way audio, HD live view, enhanced motion detection, Works with Alexa – 1 camera system",https://a.co/d/1H8samC,"Security, Safety& Entry Management",Comprehensive Security Systems/ Smart Camera
633,Wyze Labs,"WYZE Cam Pan v3 Indoor/Outdoor IP65-Rated 1080p Pan/Tilt/Zoom Wi-Fi Smart Home Security Camera with Motion Tracking for Baby & Pet, Color Night Vision, 2-Way Audio, Works with Alexa & Google Assistant",https://a.co/d/8aTVVen,"Security, Safety& Entry Management",Comprehensive Security Systems/ Smart Camera
634,Wyze Labs,Wyze Cam Pan,https://www.wyze.com/,"Security, Safety& Entry Management",Comprehensive Security Systems/ Smart Camera
635,ieGeek,"ieGeek Security Cameras Wireless Outdoor, 2K 3MP Battery Powered WiFi Security Camera with Spotlight & Siren Alarm, 2-Way Audio, Color Night Vision, AI Detection for Home Security, Works with Alexa",https://a.co/d/fx64Kil,"Security, Safety& Entry Management",Comprehensive Security Systems/ Smart Camera
636,ieGeek,"ieGeek Security Cameras Wireless Outdoor, 2K Solar WiFi Camera for Home Security System, Battery Powered Surveillance Cam with Solar Panel, 360° PTZ Color Night Vision, Motion Sensor, Works with Alexa",https://a.co/d/77soZE3,"Security, Safety& Entry Management",Comprehensive Security Systems/ Smart Camera
637,Rebluum,"Rebluum Security Camera Wireless Outdoor, 2K Solar Security Camera,Battery Powered 360°PTZ Security Camera,Color Night Vision,PIR Motion Detection,2-Way Audio,Compatible with Alexa",https://a.co/d/fRrR5KZ,"Security, Safety& Entry Management",Comprehensive Security Systems/ Smart Camera
638,litokam,"litokam 4MP Light Bulb Security Cameras Wireless Outdoor 2.4GHz, 2K 360°Cameras for Home Security Outside Indoor, Motion Detection, Siren Alarm, Color Night Vision, 24/7 Recording, Work with Alexa",https://a.co/d/gIdouPQ,"Security, Safety& Entry Management",Comprehensive Security Systems/ Smart Camera
639,ZUMIMALL,"ZUMIMALL 5G Security Camera Outdoor Wired 2pcs, 4MP Outdoor Security Camera with 360° PTZ, Outside Cameras for Home Security with 24/7 Recording, Work with Alexa, 2.4&5G WiFi, AutoTracking, IP66",https://a.co/d/2grMVeG,"Security, Safety& Entry Management",Comprehensive Security Systems/ Smart Camera
640,GALAYOU,"GALAYOU 360 Light Bulb Security Camera - Socket Wireless for Home Recording Indoor&Outdoor, WiFi Lightbulb Video Surveillance with 2K Resolution, Motion Tracking,Works Alexa",https://a.co/d/9FyzYi0,"Security, Safety& Entry Management",Comprehensive Security Systems/ Smart Camera
641,BondFree ,"BondFree 5MP 4K Solar Security Camera Outdoor, 360° WiFi Camera for Home Surveillance with 14 Spotlight Siren Alarm, Color Night Vision, 2-Way Talk, PIR Detection, Work with Alexa Google Assistant",https://a.co/d/iRSI3sJ,"Security, Safety& Entry Management",Comprehensive Security Systems/ Smart Camera
642,EVERSECU,"EVERSECU 2K 3.0MP Outdoor WiFi PTZ Security Camera, 2.4G&5G WiFi, Auto Tracking, 2 Way Audio, Color & Infrared Night Vision, Work with Alexa, SD Card & Cloud Storage, ONVIF Conformant IP CCTV Camera",https://a.co/d/9uNuw0o,"Security, Safety& Entry Management",Comprehensive Security Systems/ Smart Camera
643,MMQ,"MMQ Solar Security Cameras Wireless Outdoor, 4MP PTZ Powered Security Cameras for Home, Security Camera Outside with PIR Motion Detection, Color Night Vision, Two Way Audio, Work with Alexa",https://a.co/d/ieFZBdp,"Security, Safety& Entry Management",Comprehensive Security Systems/ Smart Camera
644,IVEW,"IVIEW ISD100 Smart Video Doorbell Wireless Control with WiFi, Door Bell Smart Home 720P HD Surveillance Security Camera with Audio & Video, PIR Motion Detection Alerts and Monitor, Night Vision",https://a.co/d/3sGqOD9,"Security, Safety& Entry Management",Comprehensive Security Systems/  Smart Doorbell
645,Logitech,Logitech Circle View Apple HomeKit-Enabled Security Camera,https://www.apple.com/shop/product/HNRE2VC/A/logitech-circle-view-apple-homekit-enabled-security-camera?fnode=7b85b4111a33637db27c5e08428ab90dbb6feeb3441d5ac8143db5ada738967115d18f88e876f9723a8f740792341c68d21fa1981d8b8479fa25490d43b35826506c83e610f8ab907d26d6326b7ae6c4985618df7f3bcf9bb8a15ec57762c23e48661a11aa5eed1085e7221e20debb97&fs=f%3Dhomebridge-securitycam%26fh%3D482b%252B49fd%252B463d,"Security, Safety& Entry Management",Comprehensive Security Systems/ Smart Camera
646,Eve,Eve Cam,https://www.apple.com/shop/product/HR202ZM/A/eve-cam?fnode=7b85b4111a33637db27c5e08428ab90dbb6feeb3441d5ac8143db5ada738967115d18f88e876f9723a8f740792341c68d21fa1981d8b8479fa25490d43b35826506c83e610f8ab907d26d6326b7ae6c4985618df7f3bcf9bb8a15ec57762c23e48661a11aa5eed1085e7221e20debb97&fs=f%3Dhomebridge-securitycam%26fh%3D482b%252B49fd%252B463d,"Security, Safety& Entry Management",Comprehensive Security Systems/ Smart Camera
647,Eve,Eve Outdoor Cam,https://www.apple.com/shop/product/HQ2L2ZM/A/eve-outdoor-cam?fnode=7b85b4111a33637db27c5e08428ab90dbb6feeb3441d5ac8143db5ada738967115d18f88e876f9723a8f740792341c68d21fa1981d8b8479fa25490d43b35826506c83e610f8ab907d26d6326b7ae6c4985618df7f3bcf9bb8a15ec57762c23e48661a11aa5eed1085e7221e20debb97&fs=f%3Dhomebridge-securitycam%26fh%3D482b%252B49fd%252B463d,"Security, Safety& Entry Management",Comprehensive Security Systems/ Smart Camera
648,Logitech,Logitech Circle View Wired Doorbell,https://www.apple.com/shop/product/HPGS2VC/A/logitech-circle-view-wired-doorbell?fnode=1a513d7288180f449391bd9973d8b99e043dacb82cef07b5a26550e5aa00ff5e345235ed2585defbb3af41d9a3b2587ea7f70aec5b4046e05ae2d3132c4bfbdfdb51a206ce019517304e64ef02b883fecb9fdab5a0d3a30ccd967eff81b8bf42675646ccd7eaffb004948f6d1e8cc0c5&fs=f%3Dhomebridge-securitycam%26fh%3D482b%252B49fd%252B463d,"Security, Safety& Entry Management",Comprehensive Security Systems/  Smart Doorbell
649,Ring (Amazon),Ring Video Doorbell Pro,https://www.amazon.com/dp/B08FCZZXZ1,"Security, Safety& Entry Management",Comprehensive Security Systems/  Smart Doorbell
650,Ring (Amazon),Ring Video Doorbell 3,https://www.amazon.com/dp/B0849J7W5X,"Security, Safety& Entry Management",Comprehensive Security Systems/  Smart Doorbell
651,Ring (Amazon),"Ring Video Doorbell Wired | Use Two-Way Talk, advanced motion detection, HD camera and real-time alerts to monitor your front door (wiring required)",https://a.co/d/aqOTz2f,"Security, Safety& Entry Management",Comprehensive Security Systems/  Smart Doorbell
652,Ring (Amazon),Ring Battery Doorbell Plus,https://ring.com/products/battery-doorbell-plus,"Security, Safety& Entry Management",Comprehensive Security Systems/  Smart Doorbell
653,Ring (Amazon),Ring Battery Doorbell Pro,https://ring.com/products/battery-doorbell-pro,"Security, Safety& Entry Management",Comprehensive Security Systems/  Smart Doorbell
654,Eufy (Anker),Eufy Security Video Doorbell(Video Doorbell S330 - 2K HD Battery Doorbell),https://us.eufy.com/collections/video-doorbell,"Security, Safety& Entry Management",Comprehensive Security Systems/  Smart Doorbell
655,Arlo,Arlo Video Doorbell,https://www.arlo.com/en-us/doorbell,"Security, Safety& Entry Management",Comprehensive Security Systems/  Smart Doorbell
656,August Home,August Doorbell Cam Pro,https://support.august.com/doorbell-cam-faq-H1VA8UJAuM,"Security, Safety& Entry Management",Comprehensive Security Systems/  Smart Doorbell
657,Aeotec,Aeotec Doorbell 6,https://aeotec.com/products/aeotec-doorbell-6/,"Security, Safety& Entry Management",Comprehensive Security Systems/  Smart Doorbell
658,Google (Nest),Nest Hello Video Doorbell,https://store.google.com/us/product/nest_hello_doorbell,"Security, Safety& Entry Management",Comprehensive Security Systems/  Smart Doorbell
659,Google (Nest),Nest Cam IQ - Indoor Security Smart 1080P HD Camera - White,https://a.co/d/9RLGHSO,"Security, Safety& Entry Management",Comprehensive Security Systems/  Smart Doorbell
660,YoLink,"YoLink Outdoor Security Siren & Smart Alarm Controller Kit - Loud 110 dB, Wireless, Battery-Powered, 1/4 Mile Range, Android-iOS App, Alexa, Google, IFTTT, Home Assistant, Hub Required!",https://a.co/d/cxerrxh,"Security, Safety& Entry Management",Comprehensive Security Systems/ Outdoor Security Siren & Smart Alarm
661,Garadget,Garadget Smart Garage Door Controller,https://www.garadget.com/,"Security, Safety& Entry Management",Comprehensive Security Systems/ Smart Garage Door Controller
662,YoLink,"YoLink Garage Door Controller and Wireless Sensor - Remote Control Existing Garage Door Opener, 1/4 Mile World's Longest Range Garage Door Control Kit Compatible with Alexa IFTTT, YoLink Hub Required",https://a.co/d/3YTIQ1w,"Security, Safety& Entry Management",Comprehensive Security Systems/ Smart Garage Door Controller
663,Chamberlain,Chamberlain MyQ Smart Garage Door Opener(Model B4505T),https://www.chamberlain.com/garage-door-openers/c/smart-garage-door-openers,"Security, Safety& Entry Management",Comprehensive Security Systems/ Smart Garage Door Controller
664,Nexx Home,Nexx Garage Smart Wi-Fi Garage Door Opener( NXG-200),https://getnexx.com/products/nexx-smart-garage-nxg200,"Security, Safety& Entry Management",Comprehensive Security Systems/ Smart Garage Door Controller
665,Tailwind Home,Tailwind iQ3 Smart WiFi Garage Door Opener,https://gotailwind.com/,"Security, Safety& Entry Management",Comprehensive Security Systems/ Smart Garage Door Controller
666,Genie,Genie Aladdin Connect Smart Garage Door Opener(Aladdin Connect Retrofit-Kit),https://www.geniecompany.com/,"Security, Safety& Entry Management",Comprehensive Security Systems/ Smart Garage Door Controller
667,Samsung,Samsung Chef Collection Dishwasher with Hidden Touch Controls in Matte Black Stainless Steel,https://www.samsung.com/us/business/builder/our-appliances/dishwashers/waterwall/hidden-touch-control-chef-collection-dishwasher-with-waterwall-technology-dw80m9990um-aa/,Kitchen & Culinary Appliances,Smart Kitchen Appliances/ Smart Dishwasher
668,Samsung,Samsung AutoRelease Smart 39dBA Dishwasher with Linear Wash in Black Stainless Steel,https://www.samsung.com/us/home-appliances/dishwashers/linear-wash/linear-wash-39dba-dishwasher-in-black-stainless-steel-dw80r9950ug-aa/?cid=pla-ecomm-pfs-ha-us-google-na-04012022-170127-&ds_e=GOOGLE-cr:0-pl:265994333-&ds_c=CN~DA+Premium+Pmax_ID~n_PR~damul_SB~ecom_PH~on_KS~pmax_MK~usnat_OB~conv_FS~lo_FF~HA_BS~da_KM~na-&ds_ag=-&ds_k=&gad_source=1&gclid=Cj0KCQjwjLGyBhCYARIsAPqTz1_uYcW_4md5jH0J17GyytwF4fPUZY2LL6Ph80sT6RxSd1SU5wbucssaAlDdEALw_wcB&gclsrc=aw.ds,Kitchen & Culinary Appliances,Smart Kitchen Appliances/ Smart Dishwasher
669,GE Appliances,GE Profile Opal Nugget Ice Maker,https://www.geappliances.com/,Kitchen & Culinary Appliances,Smart Kitchen Appliances/ Ice Maker
670,Behmor,Behmor Connected Coffee Maker,https://www.willoughbyscoffee.com/BEHCON.html,Kitchen & Culinary Appliances,Smart Kitchen Appliances/ Smart Coffee Maker
671,Hamilton Beach,"Hamilton Beach Works with Alexa Smart Coffee Maker, Programmable, 12 Cup Capacity, Black and Stainless Steel (49350R)",https://a.co/d/6pwbzpC,Kitchen & Culinary Appliances,Smart Kitchen Appliances/ Smart Coffee Maker
672,Samsung,Samsung Bespoke 4-Door Flex™ Refrigerator (29 cu. ft.) with AI Family Hub+™ and AI Vision Inside™ in Stainless Steel,https://www.samsung.com/us/home-appliances/refrigerators/bespoke/bespoke-4-door-flex-refrigerator-29-cu-ft-with-ai-family-hub-and-ai-vision-inside-n-stainless-steel-rf29db9900qdaa/,Kitchen & Culinary Appliances,Smart Kitchen Appliances/ Smart Refrigerator
673,Samsung,Samsung 23 cu. ft. Smart Counter Depth 4-Door Flex™ refrigerator with AutoFill Water Pitcher and Dual Ice Maker in Black Stainless Steel,https://www.samsung.com/us/home-appliances/refrigerators/4-door-flex/23-cu-ft-smart-counter-depth-4-door-flex-refrigerator-with-autofill-water-pitcher-and-dual-ice-maker-in-black-stainless-steel-rf23a9071sg-aa/?cid=pla-ecomm-pfs-ha-us-google-na-04012022-170127-&ds_e=GOOGLE-cr:0-pl:265994333-&ds_c=CN~DA+Premium+Pmax_ID~n_PR~damul_SB~ecom_PH~on_KS~pmax_MK~usnat_OB~conv_FS~lo_FF~HA_BS~da_KM~na-&ds_ag=-&ds_k=&gad_source=1&gclid=Cj0KCQjwjLGyBhCYARIsAPqTz1-GpfuaD7muhdaAtDHwU6g-bqJPe5NaGa-lIn7dEVTuTzZ4C8O_ue0aAraiEALw_wcB&gclsrc=aw.ds,Kitchen & Culinary Appliances,Smart Kitchen Appliances/ Smart Refrigerator
674,Samsung,Samsung Bespoke Counter Depth 4-Door Flex™ Refrigerator (23 cu. ft.) in Matte Black Steel,https://www.samsung.com/us/home-appliances/refrigerators/bespoke/23-cu-ft-smart-counter-depth-bespoke-4-door-flex-refrigerator-with-customizable-panel-colors-in-matte-black-steel-rf23a9675mt-aa/,Kitchen & Culinary Appliances,Smart Kitchen Appliances/ Smart Refrigerator
675,Samsung,Samsung Bespoke Counter Depth 4-Door Flex™ Refrigerator (23 cu. ft.) with Beverage Zone™ and Auto Open Door in Stainless Steel,https://www.samsung.com/us/home-appliances/refrigerators/bespoke/bespoke-counter-depth-4-door-flex-refrigerator-23-cu-ft-with-beverage-zone-and-auto-open-door-in-stainless-steel-rf23db9700qlaa/,Kitchen & Culinary Appliances,Smart Kitchen Appliances/ Smart Refrigerator
676,Samsung,Samsung Bespoke 4-Door Flex™ Refrigerator (29 cu. ft.) in Matte Black Steel,https://www.samsung.com/us/home-appliances/refrigerators/bespoke/29-cu-ft-smart-bespoke-4-door-flex-refrigerator-with-customizable-panel-colors-in-matte-black-steel-rf29a9675mt-aa/,Kitchen & Culinary Appliances,Smart Kitchen Appliances/ Smart Refrigerator
677,LG Electronics,23 cu. ft. Smart wi-fi Enabled InstaView® Door-in-Door® Counter-Depth Refrigerator with Craft Ice™ Maker,https://www.lg.com/us/refrigerators/lg-lrmvc2306s-french-4-door-refrigerator,Kitchen & Culinary Appliances,Smart Kitchen Appliances/ Smart Refrigerator
678,LG Electronics,26 cu. ft. Smart Mirror InstaView® Counter-Depth MAX™ French Door Refrigerator with Four Types of Ice,https://www.lg.com/us/refrigerators/lg-lrykc2606s-french-3-door-refrigerator,Kitchen & Culinary Appliances,Smart Kitchen Appliances/ Smart Refrigerator
679,GE Appliances,GE Profile™ ENERGY STAR® 27.9 Cu. Ft. Smart Fingerprint Resistant 4-Door French-Door Refrigerator with Door In Door,https://www.geappliances.com/appliance/GE-Profile-ENERGY-STAR-27-9-Cu-Ft-Smart-Fingerprint-Resistant-4-Door-French-Door-Refrigerator-with-Door-In-Door-PVD28BYNFS,Kitchen & Culinary Appliances,Smart Kitchen Appliances/ Smart Refrigerator
680,Kenmore,Kenmore Smart French Door Refrigerator,https://www.kenmore.com/products/refrigeration/refrigerators/smart/,Kitchen & Culinary Appliances,Smart Kitchen Appliances/ Smart Refrigerator
681,Smarter,"SFC01 FridgeCam Wireless Camera for Inside Any Refrigerator, Fridge, White",https://a.co/d/0KFDOXu,Kitchen & Culinary Appliances,Smart Kitchen Appliances/ Smart Refrigerator Camera
682,Apption Labs,Meater+ Wireless Smart Meat Thermometer,https://www.meater.com/,Kitchen & Culinary Appliances,Smart Kitchen Appliances/ Smart Meat Thermometer
683,Samsung,"Samsung 36"" Smart Electric Cooktop with Sync Elements in Stainless Steel",https://www.samsung.com/us/home-appliances/cooktops-and-hoods/electric-cooktops/36--built-in-electric-cooktop-with-rapid-boil-nz36k7570rs-aa/?cid=pla-ecomm-pfs-ha-us-google-na-04012022-170126-&ds_e=GOOGLE-cr:0-pl:265994333-&ds_c=CN~DA+General+Pmax_ID~n_PR~damul_SB~ecom_PH~on_KS~pmax_MK~usnat_OB~conv_FS~lo_FF~HA_BS~da_KM~na-&ds_ag=-&ds_k=&gad_source=1&gclid=Cj0KCQjwjLGyBhCYARIsAPqTz19HRlKL8bpKhGH_UGu6uoa6y1_VFWibbqtn2zg_aPOjb-IZapAvnSwaAvIAEALw_wcB&gclsrc=aw.ds,Kitchen & Culinary Appliances,Smart Kitchen Appliances/ Smart Cooktop
684,Samsung,"Samsung 36"" Smart Induction Cooktop in Stainless Steel",https://www.samsung.com/us/home-appliances/cooktops-and-hoods/induction-cooktops/36--built-in-induction-cooktop-with-flex-cookzone--nz36k7880us-aa/?cid=pla-ecomm-pfs-ha-us-google-na-04012022-170127-&ds_e=GOOGLE-cr:0-pl:265994333-&ds_c=CN~DA+Premium+Pmax_ID~n_PR~damul_SB~ecom_PH~on_KS~pmax_MK~usnat_OB~conv_FS~lo_FF~HA_BS~da_KM~na-&ds_ag=-&ds_k=&gad_source=1&gclid=Cj0KCQjwjLGyBhCYARIsAPqTz19ToMaIbr5QSlrn2712PYJla-Ell-usFdop89-p9j3SauyfqDrx6xoaAgOQEALw_wcB&gclsrc=aw.ds,Kitchen & Culinary Appliances,Smart Kitchen Appliances/ Smart Cooktop
685,Samsung,"Samsung 30"" Smart Gas Cooktop with 22K BTU Dual Power Burner in Stainless Steel (Model NA30N7755TS/AA)",https://www.samsung.com/us/home-appliances/cooktops-and-hoods/gas-cooktops/30-gas-cooktop-with-22k-btu-true-dual-power-burner-2018-na30n7755ts-aa/?cid=pla-ecomm-pfs-ha-us-google-na-04012022-170126-&ds_e=GOOGLE-cr:0-pl:265994333-&ds_c=CN~DA+General+Pmax_ID~n_PR~damul_SB~ecom_PH~on_KS~pmax_MK~usnat_OB~conv_FS~lo_FF~HA_BS~da_KM~na-&ds_ag=-&ds_k=&gad_source=1&gclid=Cj0KCQjwjLGyBhCYARIsAPqTz18Yj9y83lkOheYsKXR0GQKw8Ke6QJvltQ5NVREb3xZNzY2oYv8xTPEaAjBtEALw_wcB&gclsrc=aw.ds,Kitchen & Culinary Appliances,Smart Kitchen Appliances/ Smart Gas Cooktop
686,Samsung,"Samsung 36"" Chef Collection Gas Cooktop with 22K BTU Dual Power Burner in Matte Black Stainless Steel",https://www.samsung.com/us/business/builder/our-appliances/cooktops-and-hoods/gas-cooktops/36-gas-22k-btu-dual-power-burner-chef-collection-cooktop-na36m9750tm-aa/,Kitchen & Culinary Appliances,Smart Kitchen Appliances/ Smart Cooktop
